{
  "invocationId": "inv-fixture-visual-1",
  "tenantId": "11111111-1111-4111-8111-111111111111",
  "workflowKey": "copy-review",
  "agentKey": "design-agent",
  "actionKey": "create_static_variation",
  "trace": {
    "correlationId": "corr-fixture-1",
    "transactionId": "txn_fixture_1",
    "causationId": null,
    "parentTransactionId": null,
    "workflowId": "wf-fixture-1",
    "taskId": "task-fixture-1",
    "runId": "run-fixture-1"
  },
  "classification": {
    "sources": [
      {
        "kind": "context_package",
        "ref": "ctx-fixture-1"
      }
    ],
    "declared": null
  },
  "messages": [
    {
      "role": "user",
      "content": "Variação estática sintética."
    }
  ],
  "inputModalities": [
    "text"
  ],
  "inputTokensHint": 400,
  "requestedImages": 2
}
